{"first_year":2017,"reference_year":2025,"years":[2017,2018,2019,2020,2021,2022,2023,2024,2025,2026],"weather_features":["temp_max_c","temp_min_c","precip_log1p_mm","snow_log1p_cm","is_weekend"],"inputs":[{"key":"temp_max_c","label":"Daily high","unit":"\u00b0C","feature":"temp_max_c","transform":"used as published"},{"key":"temp_min_c","label":"Daily low","unit":"\u00b0C","feature":"temp_min_c","transform":"used as published"},{"key":"precip_mm","label":"Precipitation","unit":"mm","feature":"precip_log1p_mm","transform":"ln(1 + mm)"},{"key":"snow_cm","label":"Snowfall","unit":"cm","feature":"snow_log1p_cm","transform":"ln(1 + cm)"}],"calendar_inputs":[{"key":"is_weekend","label":"Weekend","transform":"one indicator, Saturday and Sunday"},{"key":"month","label":"Calendar month","transform":"one level per month in the window, so each month carries its own; held at 2025 on this page"}],"reference_levels":{"note":"The earliest calendar month each system covers is its reference level and is absorbed into the intercept."},"response":"ln(daily trips)","fit_basis":"in-sample: every statistic is computed on the same days the model was fitted to, with no holdout","envelope_note":"The per-month range is what the model has actually seen in that month of the year. Outside it the model refuses rather than extrapolating.","prediction_note":"exp(intercept + sum of coefficient x feature) is the typical day for those conditions, near the median. The average day runs higher by the smearing factor.","models":[{"system_id":"mtl-bixi","features":["temp_max_c","temp_min_c","precip_log1p_mm","snow_log1p_cm","is_weekend","level_2017-05","level_2017-06","level_2017-07","level_2017-08","level_2017-09","level_2017-10","level_2017-11","level_2018-04","level_2018-05","level_2018-06","level_2018-07","level_2018-08","level_2018-09","level_2018-10","level_2018-11","level_2019-04","level_2019-05","level_2019-06","level_2019-07","level_2019-08","level_2019-09","level_2019-10","level_2020-04","level_2020-05","level_2020-06","level_2020-07","level_2020-08","level_2020-09","level_2020-10","level_2020-11","level_2021-04","level_2021-05","level_2021-06","level_2021-07","level_2021-08","level_2021-09","level_2021-10","level_2021-11","level_2022-04","level_2022-05","level_2022-06","level_2022-07","level_2022-08","level_2022-09","level_2022-10","level_2022-11","level_2023-04","level_2023-05","level_2023-06","level_2023-07","level_2023-08","level_2023-09","level_2023-10","level_2023-11","level_2023-12","level_2024-01","level_2024-02","level_2024-03","level_2024-04","level_2024-05","level_2024-06","level_2024-07","level_2024-08","level_2024-09","level_2024-10","level_2024-11","level_2024-12","level_2025-01","level_2025-02","level_2025-03","level_2025-04","level_2025-05","level_2025-06","level_2025-07","level_2025-08","level_2025-09","level_2025-10","level_2025-11","level_2025-12","level_2026-01","level_2026-02","level_2026-03","level_2026-04","level_2026-05","level_2026-06"],"blocks":["2017-04","2017-05","2017-06","2017-07","2017-08","2017-09","2017-10","2017-11","2018-04","2018-05","2018-06","2018-07","2018-08","2018-09","2018-10","2018-11","2019-04","2019-05","2019-06","2019-07","2019-08","2019-09","2019-10","2020-04","2020-05","2020-06","2020-07","2020-08","2020-09","2020-10","2020-11","2021-04","2021-05","2021-06","2021-07","2021-08","2021-09","2021-10","2021-11","2022-04","2022-05","2022-06","2022-07","2022-08","2022-09","2022-10","2022-11","2023-04","2023-05","2023-06","2023-07","2023-08","2023-09","2023-10","2023-11","2023-12","2024-01","2024-02","2024-03","2024-04","2024-05","2024-06","2024-07","2024-08","2024-09","2024-10","2024-11","2024-12","2025-01","2025-02","2025-03","2025-04","2025-05","2025-06","2025-07","2025-08","2025-09","2025-10","2025-11","2025-12","2026-01","2026-02","2026-03","2026-04","2026-05","2026-06"],"reference_level_block":"2017-04","intercept":9.020279658,"coefficients":{"temp_max_c":0.03691259,"temp_min_c":-0.003336102,"precip_log1p_mm":-0.152250452,"snow_log1p_cm":-0.080709863,"is_weekend":-0.118651703,"level_2017-05":0.261383814,"level_2017-06":0.423710278,"level_2017-07":0.493506656,"level_2017-08":0.44782183,"level_2017-09":0.334031676,"level_2017-10":0.231666435,"level_2017-11":0.023596581,"level_2018-04":-0.035657028,"level_2018-05":0.472211711,"level_2018-06":0.542000049,"level_2018-07":0.365150412,"level_2018-08":0.490871931,"level_2018-09":0.496497648,"level_2018-10":0.348564993,"level_2018-11":0.152607665,"level_2019-04":0.204445022,"level_2019-05":0.650580468,"level_2019-06":0.629538348,"level_2019-07":0.515484756,"level_2019-08":0.601377658,"level_2019-09":0.656000094,"level_2019-10":0.479549506,"level_2020-04":-1.049888818,"level_2020-05":-0.318655835,"level_2020-06":-0.03528057,"level_2020-07":0.025762075,"level_2020-08":0.114588538,"level_2020-09":0.162721262,"level_2020-10":-0.064913296,"level_2020-11":-0.497326273,"level_2021-04":-0.22395495,"level_2021-05":0.247511461,"level_2021-06":0.365134332,"level_2021-07":0.495609597,"level_2021-08":0.431831758,"level_2021-09":0.715538641,"level_2021-10":0.63147987,"level_2021-11":0.535568888,"level_2022-04":0.503390144,"level_2022-05":0.912424397,"level_2022-06":1.048924855,"level_2022-07":0.929107197,"level_2022-08":0.978759167,"level_2022-09":1.094524599,"level_2022-10":0.981299752,"level_2022-11":0.905472111,"level_2023-04":0.966783899,"level_2023-05":1.170896675,"level_2023-06":1.158253877,"level_2023-07":1.240727912,"level_2023-08":1.268701431,"level_2023-09":1.308047531,"level_2023-10":1.290316088,"level_2023-11":0.745032507,"level_2023-12":-0.947262886,"level_2024-01":-1.35299921,"level_2024-02":-1.210155382,"level_2024-03":-0.966000808,"level_2024-04":0.645998348,"level_2024-05":1.26069045,"level_2024-06":1.279530423,"level_2024-07":1.251932519,"level_2024-08":1.268459196,"level_2024-09":1.362010993,"level_2024-10":1.325419539,"level_2024-11":0.958744938,"level_2024-12":-0.651705533,"level_2025-01":-0.977733597,"level_2025-02":-1.485334001,"level_2025-03":-0.917768629,"level_2025-04":0.631878411,"level_2025-05":1.306967313,"level_2025-06":1.391156948,"level_2025-07":1.336436374,"level_2025-08":1.365654267,"level_2025-09":1.466130956,"level_2025-10":1.429049417,"level_2025-11":0.95813351,"level_2025-12":-0.886709077,"level_2026-01":-1.120733397,"level_2026-02":-1.085592277,"level_2026-03":-0.91297808,"level_2026-04":0.87291169,"level_2026-05":1.371401923,"level_2026-06":1.359013452},"fit":{"days":2415,"parameters":91,"month_levels":86,"weather_parameters":5,"first_day":"2017-04-15","last_day":"2026-06-30","r2_log":0.940046,"adj_r2_log":0.937724,"residual_sd_log":0.275125,"r2_trips":0.919062,"mae_trips":4282.327752,"median_abs_pct_error":12.285235,"mean_daily_trips":31515.274948,"max_daily_trips":98618,"max_daily_date":"2025-06-11","smearing_factor":1.033816,"cv_folds":5,"cv_held_out_days":2415,"cv_r2_log":0.936705,"cv_median_abs_pct_error":12.618348},"excluded_days":{"before_common_window":645,"incomplete_month":1,"no_weather_observation":51},"envelope":{"temp_max_c":{"min":-20.4,"max":36.6,"median":19.7},"temp_min_c":{"min":-25.1,"max":24.0,"median":9.2},"precip_mm":{"min":0.0,"max":154.0,"median":0.0},"snow_cm":{"min":0.0,"max":36.8,"median":0.0}},"months":[{"month":1,"days":85,"first_year":2024,"last_year":2026,"years":3,"mean_trips":2044,"reference_days":29,"reference_mean_trips":2352,"ranges":{"temp_max_c":{"min":-20.4,"max":9.1,"median":-4.3},"temp_min_c":{"min":-25.1,"max":1.6,"median":-11.6},"precip_mm":{"min":0.0,"max":22.0,"median":0.4},"snow_cm":{"min":0.0,"max":16.8,"median":0.2}}},{"month":2,"days":83,"first_year":2024,"last_year":2026,"years":3,"mean_trips":2137,"reference_days":27,"reference_mean_trips":1616,"ranges":{"temp_max_c":{"min":-15.3,"max":14.9,"median":-3.0},"temp_min_c":{"min":-21.8,"max":2.4,"median":-11.8},"precip_mm":{"min":0.0,"max":36.8,"median":0.0},"snow_cm":{"min":0.0,"max":36.8,"median":0.0}}},{"month":3,"days":87,"first_year":2024,"last_year":2026,"years":3,"mean_trips":3818,"reference_days":30,"reference_mean_trips":4173,"ranges":{"temp_max_c":{"min":-12.9,"max":19.3,"median":4.3},"temp_min_c":{"min":-20.9,"max":7.2,"median":-4.6},"precip_mm":{"min":0.0,"max":18.4,"median":0.6},"snow_cm":{"min":0.0,"max":8.8,"median":0.0}}},{"month":4,"days":219,"first_year":2017,"last_year":2026,"years":10,"mean_trips":19900,"reference_days":30,"reference_mean_trips":23982,"ranges":{"temp_max_c":{"min":-0.7,"max":27.9,"median":11.6},"temp_min_c":{"min":-7.0,"max":12.1,"median":2.8},"precip_mm":{"min":0.0,"max":33.8,"median":0.2},"snow_cm":{"min":0.0,"max":31.6,"median":0.0}}},{"month":5,"days":306,"first_year":2017,"last_year":2026,"years":10,"mean_trips":35721,"reference_days":31,"reference_mean_trips":51802,"ranges":{"temp_max_c":{"min":6.0,"max":36.6,"median":19.6},"temp_min_c":{"min":-0.6,"max":21.6,"median":8.4},"precip_mm":{"min":0.0,"max":37.2,"median":0.0},"snow_cm":{"min":0.0,"max":0.0,"median":0.0}}},{"month":6,"days":290,"first_year":2017,"last_year":2026,"years":10,"mean_trips":43971,"reference_days":30,"reference_mean_trips":74611,"ranges":{"temp_max_c":{"min":12.6,"max":35.6,"median":25.1},"temp_min_c":{"min":2.8,"max":23.8,"median":14.7},"precip_mm":{"min":0.0,"max":52.4,"median":0.0},"snow_cm":{"min":0.0,"max":0.0,"median":0.0}}},{"month":7,"days":270,"first_year":2017,"last_year":2025,"years":9,"mean_trips":43650,"reference_days":31,"reference_mean_trips":75166,"ranges":{"temp_max_c":{"min":19.2,"max":36.1,"median":27.9},"temp_min_c":{"min":11.4,"max":24.0,"median":18.1},"precip_mm":{"min":0.0,"max":81.6,"median":0.0},"snow_cm":{"min":0.0,"max":0.0,"median":0.0}}},{"month":8,"days":276,"first_year":2017,"last_year":2025,"years":9,"mean_trips":43430,"reference_days":31,"reference_mean_trips":73821,"ranges":{"temp_max_c":{"min":15.3,"max":35.1,"median":26.3},"temp_min_c":{"min":8.5,"max":24.0,"median":16.3},"precip_mm":{"min":0.0,"max":154.0,"median":0.0},"snow_cm":{"min":0.0,"max":0.0,"median":0.0}}},{"month":9,"days":